{
  "$schema": "./diagnostics.schema.json",
  "specVersion": "0.2",
  "description": "Registry of every Compyla diagnostic code and operation error (markdown-spec.md §11, §10.6). Codes are public API: never reused for a different meaning; retired codes stay with status \"retired\" (§14).",
  "diagnostics": [
    {
      "code": "ambiguous_break",
      "severity": "warning",
      "stage": "parse",
      "profiles": [
        "*"
      ],
      "strictPromotable": false,
      "position": "underline",
      "since": "0.2",
      "status": "active",
      "spec": "§4.9",
      "summary": "A paragraph line directly above --- became a level-2 heading; a break was probably intended."
    },
    {
      "code": "directive_malformed",
      "severity": "warning",
      "stage": "parse",
      "profiles": [
        "*"
      ],
      "strictPromotable": true,
      "position": "fence",
      "since": "0.2",
      "status": "active",
      "spec": "§1.3",
      "summary": "A line looks like a directive fence but isn't one (indented, inside a quote or list item, not matching the grammar, or a closer with nothing open)."
    },
    {
      "code": "directive_unclosed",
      "severity": "warning",
      "stage": "parse",
      "profiles": [
        "*"
      ],
      "strictPromotable": true,
      "position": "node",
      "since": "0.2",
      "status": "active",
      "spec": "§1.3",
      "summary": "A directive opener has no matching closer. It becomes a directive with no children; the following lines are parsed as ordinary content."
    },
    {
      "code": "document_in_code_fence",
      "severity": "warning",
      "stage": "parse",
      "profiles": [
        "*"
      ],
      "strictPromotable": false,
      "position": "node",
      "since": "0.2",
      "status": "active",
      "spec": "§4.9",
      "summary": "The whole body is one markdown code block, as LLMs produce when asked for markdown."
    },
    {
      "code": "frontmatter_invalid",
      "severity": "warning",
      "stage": "parse",
      "profiles": [
        "*"
      ],
      "strictPromotable": true,
      "position": "frontmatter",
      "since": "0.2",
      "status": "active",
      "spec": "§2",
      "summary": "Frontmatter is not valid YAML, is not a mapping, or uses a feature outside the JSON-compatible subset. meta is treated as empty."
    },
    {
      "code": "invalid_character",
      "severity": "warning",
      "stage": "parse",
      "profiles": [
        "*"
      ],
      "strictPromotable": true,
      "position": "char",
      "since": "0.2",
      "status": "active",
      "spec": "§1.1",
      "summary": "A character XML forbids, or an unpaired surrogate, was replaced with U+FFFD."
    },
    {
      "code": "link_scheme_blocked",
      "severity": "warning",
      "stage": "parse",
      "profiles": [
        "*"
      ],
      "strictPromotable": true,
      "position": "construct",
      "since": "0.2",
      "status": "active",
      "spec": "§4.5",
      "summary": "A link destination is outside the allowlist; the link is removed and its text kept."
    },
    {
      "code": "meta_value_invalid",
      "severity": "warning",
      "stage": "parse",
      "profiles": [
        "*"
      ],
      "strictPromotable": true,
      "position": "key",
      "since": "0.2",
      "status": "active",
      "spec": "§2",
      "summary": "A known frontmatter key has a value of the wrong type or form; the key is removed from meta."
    },
    {
      "code": "spec_version_unsupported",
      "severity": "warning",
      "stage": "parse",
      "profiles": [
        "*"
      ],
      "strictPromotable": true,
      "position": "key",
      "since": "0.2",
      "status": "active",
      "spec": "§2",
      "summary": "The frontmatter spec value differs from the implemented version; the document is processed under the implemented version."
    },
    {
      "code": "table_malformed",
      "severity": "warning",
      "stage": "parse",
      "profiles": [
        "*"
      ],
      "strictPromotable": true,
      "position": "node",
      "since": "0.2",
      "status": "active",
      "spec": "§4.9",
      "summary": "A paragraph looks like a table whose header and delimiter rows have different cell counts; it is kept as text."
    },
    {
      "code": "unsupported_content",
      "severity": "warning",
      "stage": "parse",
      "profiles": [
        "*"
      ],
      "strictPromotable": true,
      "position": "construct",
      "since": "0.2",
      "status": "active",
      "spec": "§4.8",
      "summary": "A recognized construct with no IR representation (an image mixed with text, a footnote, an HTML block, a known HTML inline tag) was dropped."
    },
    {
      "code": "diagnostics_truncated",
      "severity": "warning",
      "stage": "any",
      "profiles": [
        "*"
      ],
      "strictPromotable": false,
      "position": "none",
      "since": "0.2",
      "status": "active",
      "spec": "§11.2",
      "summary": "The diagnostics list was capped; further diagnostics were not reported."
    },
    {
      "code": "limit_exceeded",
      "severity": "error",
      "stage": "any",
      "profiles": [
        "*"
      ],
      "strictPromotable": false,
      "position": "construct",
      "since": "0.2",
      "status": "active",
      "spec": "§12.1",
      "summary": "Input exceeds a limit (size, nesting, table cells, slides, sheets, image size); it is not processed further. Input-size limits have no line."
    },
    {
      "code": "directive_misplaced",
      "severity": "warning",
      "stage": "validate",
      "profiles": [
        "*"
      ],
      "strictPromotable": true,
      "position": "node",
      "since": "0.2",
      "status": "active",
      "spec": "§1.5",
      "summary": "A directive is in a position where its profile gives it no effect; it is ignored."
    },
    {
      "code": "duplicate_sheet_name",
      "severity": "warning",
      "stage": "validate",
      "profiles": [
        "xlsx"
      ],
      "strictPromotable": true,
      "position": "node",
      "since": "0.1",
      "status": "active",
      "spec": "§9.6",
      "summary": "A sheet name repeats an earlier one or is History (case-insensitive); a numeric suffix is appended."
    },
    {
      "code": "font_unresolved",
      "severity": "warning",
      "stage": "validate",
      "profiles": [
        "docx",
        "pdf",
        "pptx"
      ],
      "strictPromotable": true,
      "position": "none",
      "since": "0.1",
      "status": "active",
      "spec": "§3, §11.2",
      "summary": "A font family the template references can't be resolved; the viewer substitutes one. Validate stage when a template and font resolver are available, else render stage."
    },
    {
      "code": "formula_error",
      "severity": "warning",
      "stage": "validate",
      "profiles": [
        "xlsx"
      ],
      "strictPromotable": true,
      "position": "row",
      "since": "0.1",
      "status": "active",
      "spec": "§9.3",
      "summary": "A formula doesn't match the grammar, calls a function off the allowlist, or qualifies an unknown sheet; the cell is written as literal text."
    },
    {
      "code": "formula_ref_out_of_range",
      "severity": "warning",
      "stage": "validate",
      "profiles": [
        "xlsx"
      ],
      "strictPromotable": true,
      "position": "row",
      "since": "0.2",
      "status": "active",
      "spec": "§9.3",
      "summary": "An unqualified reference falls outside its table's own grid."
    },
    {
      "code": "heading_skip",
      "severity": "warning",
      "stage": "validate",
      "profiles": [
        "docx",
        "pdf"
      ],
      "strictPromotable": false,
      "position": "node",
      "since": "0.1",
      "status": "active",
      "spec": "§6.3",
      "summary": "A heading skips a level relative to its parent section in the same heading tree."
    },
    {
      "code": "heading_too_deep",
      "severity": "warning",
      "stage": "validate",
      "profiles": [
        "pptx"
      ],
      "strictPromotable": false,
      "position": "node",
      "since": "0.1",
      "status": "active",
      "spec": "§8.7",
      "summary": "A demoted heading of level 4 or deeper inside a slide."
    },
    {
      "code": "image_unresolved",
      "severity": "warning",
      "stage": "validate",
      "profiles": [
        "docx",
        "pdf",
        "pptx"
      ],
      "strictPromotable": true,
      "position": "node",
      "since": "0.1",
      "status": "active",
      "spec": "§5, §10.3",
      "summary": "An image source doesn't resolve; its alt text is rendered in its place."
    },
    {
      "code": "image_unsupported",
      "severity": "warning",
      "stage": "validate",
      "profiles": [
        "docx",
        "pdf",
        "pptx"
      ],
      "strictPromotable": true,
      "position": "node",
      "since": "0.2",
      "status": "active",
      "spec": "§4.7, §5",
      "summary": "An image's bytes are not PNG, JPEG or GIF; its alt text is rendered in its place."
    },
    {
      "code": "invalid_directive_args",
      "severity": "warning",
      "stage": "validate",
      "profiles": [
        "*"
      ],
      "strictPromotable": true,
      "position": "node",
      "since": "0.1",
      "status": "active",
      "spec": "§1.6",
      "summary": "A directive's arguments are malformed (a repeated key, a malformed or out-of-range value, a missing argument, a bad columns entry, anchor or table name); it falls back as its profile defines."
    },
    {
      "code": "invalid_margins",
      "severity": "warning",
      "stage": "validate",
      "profiles": [
        "docx",
        "pdf"
      ],
      "strictPromotable": true,
      "position": "key",
      "since": "0.1",
      "status": "active",
      "spec": "§7",